,Name,Year,Status ,Birth Date,Birth Place,Gender,Alma Mater,Undergraduate Major,Graduate Major,Military Rank,Military Branch,Space Flights,Space Flight (hr),Space Walks,Space Walks (hr),Missions,Death Date,Death Mission
0,Sergey Avdeyev,1987,Retired,1956-01-01 00:00:00,"Chapayevsk, Samara Oblast",Male, Moscow Physics-Engineering Institute,Engineering Physics,Engineering Physics,,,3,17942,10.0,42.0,"Soyuz TM-15, Soyuz TM-22, Soyuz TM-28",,
1,Victor Afanasyev,1988,Retired,1948-12-31 00:00:00,Bryansk,Male,Ordzhonikidze Aviation Institute/Kachynskoye Military Pilot School ,Pilot,Pilot,Colonel,Russian Air Force,4,13338,7.0,38.0,"Soyuz TM-11, Soyuz TM-18, Soyuz TM-29, Soyuz TM-33",,
2,Vladimir Aksyonov,1973,Retired,1935-02-01 00:00:00,"Giblitsy, Kasimovsky District, Ryazan Oblast",Male,Institute of Engineering/Air Force Institute/Polytechnical Institute,Astronautical Engineering,doctorate degree on spacecraft steering systems,Lieutenant colonel,Russian Air Force,2,284,,,"Soyuz 22, Soyuz T-2",,
3,Alexander Alexanderov,1978,Retired,1943-02-20 00:00:00,"Moscow, Russia",Male,Bauman Moscow State Technical University ,,,,,2,7434,,,"Soyuz T-9, Soyuz TM-3",,
4,Anatoly Artsebarsky,1985,Retired,1956-09-09 00:00:00,"Prosyana, Ukrainian SSR, Soviet Union",Male,Kharkov Higher Military Aviation School of Pilots/The Russian Presidential Academy of National Economy and Public Administration,Military pilot-engineer ,Master of Business Administration (MBA),Сolonel,Russian Air Force,1,3471,6.0,33.0,Soyuz TM-12,,
5,Yury Artyukhin,1963,Deceased,1930-06-22 00:00:00,"Pershutino, Moscow Oblast, Russia",Male,Air Force Institute,"doctorate in engineering, specialising in military communication systems",,Colonel,Russian Air Force,1,137,,,Soyuz 14,4/08/ 1998,
6,Oleg Atkov,1983,Retired,1949-05-09 00:00:00,"Khvorostyanka, USSR",Male,Russian Academy of Medical Science/Myasnikov Institute of Clinical Cardiology,Engineering Physics,doctorate in engineering,,,1,5686,,,Soyuz T-10,,
7,Toktar Aubakirov,1991,Retired,1946-07-27 00:00:00,"Karaganda, Kazakh SSR, Soviet Union",Male,the Armavir Military Aviation Institute of the Anti-Air Defence Pilots,,,Major General,Russian Air Force,1,190,,,Soyuz TM-13,,
8,Oleg Artemyev,2003,Active,1970-12-28 00:00:00,"Riga,Latvia",Male,Bauman Moscow State Technical University / the Russian Presidential Academy of National Economy and Public Administration,Engineering ,Engineering ,,,1,4061,2.0,12.0,Soyuz ТМА-12М,,
9,Alexander Balandin,1978,Retired,1953-07-30 00:00:00,"Fryazino, Moscow Oblast",Male,Bauman Moscow State Technical University,Engineering,,,,1,4297,2.0,10.0,Soyuz TM-9,,
10,Yury Baturin,1997,Retired,1949-06-12 00:00:00," Moscow, Soviet Union",Male, Moscow Institute of Physics and Technology/ Moscow state university,Engineering,Law/journalism,,,2,473,,,"Soyuz TM-28, Soyuz TM-32",,
11,Pavel Belyayev,1960,Deceased,26/06/ 1925,"Chelishchevo,Northern Dvina ",Male,,,,Colonel,Russian Air Force,1,1,,,Voskhod 2,1970-01-10 00:00:00,
12,Georgy Beregovoy,1962,Deceased,1921-04-05 00:00:00,"Fedorivka, Poltava Oblast, Soviet Union",Male,Air Force Academy,,,Lieutenant General,Russian Air Force,1,94,,,Soyuz 3,1995-06-30 00:00:00,
13,Anatoly Berezovoy,1970,Retired,11/04/ 1942," Enem, Adyghe Autonomous Oblast,",Male,Kachin Higher Military Aviation School of Pilots,,,Colonel,Russian Air Force,1,5073,1.0,2.0,Soyuz T-5,,
14,Andrey Borisenko,2003,Active,1964-04-17 00:00:00,"Leningrad, Russia",Male,Leningrad Military Mechanical Institute ,Flight and Control Dynamics,,,,2,8097,,,"Soyuz TMA-21, Soyuz MS-02",,
15,Nikolay Budarin,1989,Retired,1953-04-29 00:00:00,"Kirya, Chuvashia",Male, Moscow Aviation Institute, mechanical engineering,,Hero of the Russian Federation,,3,10657,8.0,44.0,"STS-71 (Atlantis), Soyuz TM-27, STS-113 (Endeavour)",,
16,Valery Bykovsky ,1960,Retired,1934-08-02 00:00:00,"Pavlovsky Posad, Soviet Union",Male,,,,Major General,Russian Air Force,3,497,,,"Vostok 5, Soyuz 22, Soyuz 31",,
17,Vladimir Vasyutin,1978,Deceased,1952-03-08 00:00:00,"Kharkiv, Ukrainian SSR",Male,,,,Lieutenant General,Russian Air Force,1,1557,,,Soyuz T-14,2002-07-19 00:00:00,
18,Alexander Victorenko,1978,Retired,1947-03-29 00:00:00,"Olginka, Kazakh SSR",Male,,,,,,4,13294,6.0,19.0,"Soyuz TM-3, Soyuz TM-8, Soyuz TM-14, Soyuz TM-20",,
19,Pavel Vinogradov,1953,Retired,1953-08-31 00:00:00,"Magadan, USSR",Male,Moscow Aviation Institute,,,Test Cosmonaut,Russian Air Force,3,13126,7.0,38.0,"Soyuz TM-26, Soyuz TMA-8, Soyuz TMA-08M",,
20,Igor Volk,1956,Retired,1937-04-12 00:00:00,"Zmiiv, Kharkiv Oblast",Male,Kirovohrad Military Aviation School of Pilots,,,Colonel,Russian Air Force,1,283,,,Soyuz T-12,2017-01-03 00:00:00,
21,Alexander Volkov ,1978,Retired,1948-05-27 00:00:00,"Horlivka, Ukrainian SSR",Male,Kharkov Higher Military Aviation School of Pilots,,,Colonel,Russian Air Force,3,9395,2.0,10.0,"Soyuz T-14, Soyuz TM-7, Soyuz TM-13",,
22,Sergey Volkov,1997,Retired,1973-04-01 00:00:00," Chuhuiv, Ukrainian SSR",Male,Tambov Higher Military Aviation School for pilots named after MM Raskova,,,Colonel,Russian Air Force,3,13150,4.0,23.0,"Soyuz TMA-12, Soyuz TMA-02M, Soyuz TMA-18M",,
23,Vladislav Volkov ,1966,Retired,23/11/ 1935,"Moscow, Soviet Union",Male, Moscow Aviation Institute,aviation engineer ,,Second lieutenant,Russian Air Force,2,689,,,"Soyuz 7, Soyuz 11",1971-06-30 00:00:00,Soyuz 11
24,Boris Volynov ,1960,Retired,1934-12-18 00:00:00,"Irkutsk, Russian SFSR",Male, Zhukovsky Air Force Engineering Academy,pilot-engineer-cosmonaut,pilot-engineer-cosmonaut,Colonel,Russian Air Force,2,1255,,,"Soyuz 5, Soyuz 21",,
25,Yury Gagarin,1959,Deceased,1934-03-09 00:00:00,"Klushino, Russian SFSR",Male,Chkalov Air Force Pilot's School in Orenburg,,,Colonel,Russian Air Force,1,1,,,Vostok 1,1968-03-27 00:00:00,
26,Yury Gidzenko,1987,Retired,1962-03-26 00:00:00,"Elanets, Mykolaiv Oblast, Ukraine",Male, The Higher Military Pilot School/ Moscow State University of Geodesy and Cartography,,,,,3,7918,2.0,3.0,"Soyuz TM-22, Soyuz TM-31, Soyuz TM-34",,
27,Yury Glazkov,1965,Deceased,1939-10-02 00:00:00,"Moscow, USSR",Male,Kharkov Military Engineering High Schoo,Technical sciences,Technical sciences ,Major General,Russian Air Force,1,425,,,Soyuz 24,2008-12-09 00:00:00,
28,Victor Gorbatko ,1960,Deceased,1934-12-03 00:00:00,"Ventsy-Zarya, Krasnodarskii Krai",Male, Zhukovsky Air Force Engineering Academy,,,Major General,Russian Air Force,3,732,,,"Soyuz 7, Soyuz 24, Soyuz 37",2017-05-17 00:00:00,
29,Georgy Grechko,1966,Deceased,1931-05-25 00:00:00,"Moscow, Russia",Male, Leningrad Institute of Mechanics,Mathematics,Mathematics,,,3,3236,1.0,1.0,"Soyuz 17, Soyuz 26, Soyuz T-14",2017-04-08 00:00:00,
30,Alexey Gubarev,1963,Deceased,1931-03-29 00:00:00,"Gvardeitsi, Samara Oblast, USSR",Male, Soviet Naval Aviation School,Engineering,Engineering,Major General,Russian Naval Air Force,3,899,,,"Soyuz 17, Soyuz 28",2015-02-21 00:00:00,
31,Vladimir Dezhurov,1987,Retired,1962-07-30 00:00:00,"Yavas, Mordovia, Soviet Union",Male,S.I. Gritsevits Kharkov Higher Military Aviation School,,,Lieutenant Colonel,Russian Air Force,2,5861,9.0,37.0,"Soyuz TM-21, STS-105 (Discovery)",,
32,Georgy Dobrovolsky,1963,Deceased,1928-06-01 00:00:00,"Odessa, Ukrainian SSR, Soviet Union",Male,The Air Force Academy named after Yu. A. Gagarin,,,Lieutenant colonel,Russian Air Force,1,570,,,Soyuz 11,1971-06-30 00:00:00,
33,Lev Demin,1963,Deceased,1926-01-11 00:00:00,"Moscow, Russia",Male,Soviet Air Force Engineering Academy,,,Colonel,Russian Air Force,1,48,,,Soyuz 15,1998-12-18 00:00:00,
34,Vladimir Dzhanibekov,1970,Retired,1942-05-13 00:00:00,"Skandar, Tashkent Region, Uzbek SSR, Soviet Union",Male,Leningrad University ,,,Major General,Russian Air Force,5,3495,2.0,9.0,"Soyuz 27, Soyuz 39, Soyuz T-6, Soyuz T-12, Soyuz T-13",,
35,Alexey Yeliseyev,1966,Retired,1934-07-13 00:00:00,"Zhizdra, Kaluga region",Male,Bauman Moscow State Technical University,,,,,3,216,,,"Soyuz 5, Soyuz 8, Soyuz 10",,
36,Boris Egorov,1964,Deceased,1937-11-26 00:00:00,"Moscow, Russia",Male,I. M. Sechenov Institute of Evolutionary Physiology and Biochemistry,,,,,1,24,,,Voshod 1,1994-09-12 00:00:00,
37,Vitaly Zholobov,1963,Retired,1937-06-18 00:00:00,"Zburjevka, Ukrainian SSR, Soviet Union",Male,Azerbaijan Institute of Petroleum and Chemistry/,,,Colonel,Russian Air Force,1,1182,,,Soyuz 21,,
38,Sergey Zalyotin,1990,Retired,1962-04-21 00:00:00,"Shchyokino, Russia",Male,Borisoglebsk Higher Military School,,,Colonel,Russian Air Force,2,2008,,,"Soyuz TM-30, Soyuz TMA-1",,
39,Vyacheslav Zudov,1965,Retired,1942-01-08 00:00:00,"Bor, Russia",Male,Balashov Higher Military Aviation School of Pilots,,,Colonel,Russian Air Force,1,48,,,Soyuz 23,,
40,Anatoli Ivanishin,2003,Active,1969-01-15 00:00:00,"Irkutsk, Russian SFSR",Male,Chernigov High Aviation School / Irkutsk Polytechnic Institute/Moscow State University in Economics,,,Сolonel,Russian Air Force,2,6729,,,"Soyuz TMA-22, Soyuz MS-01",,
41,Alexander Ivanchenkov,1973,Retired,1940-09-28 00:00:00,"Ivanteyevka, USSR",Male,Moscow Aviation Institute,,,,,2,3528,,,"Soyuz 29/31, Soyuz-T-6",,
42,Alexander Kaleri,1984,Active,1956-05-13 00:00:00,"Jūrmala, Latvian SSR, Soviet Union",Male,Moscow Institute of Physics and Technology,,,,,5,18456,5.0,23.0,"Soyuz TM-14, Soyuz TM-24, Soyuz TM-30, Soyuz TMA-3, Soyuz TMA-01M",,
43,Leonid Kizim,1965,Deceased,1941-08-05 00:00:00,"Lyman, Ukraine",Male,Chernigov High Aviation School ,,,Colonel General,Russian Air Force,3,8976,,,"Soyuz T-3, Soyuz T-10, Soyuz T-15",2010-06-14 00:00:00,
44,Pyotr Klimuk,1964,Retired,1942-07-10 00:00:00,"Kamaroŭka, USSR",Male,Chernigov High Aviation School ,,,Colonel General,Russian Air Force,3,1890,,,"Soyuz 13, Soyuz 18, Soyuz 30",,
45,Vladimir Kovalyonok,1967,Retired,1942-03-03 00:00:00,"Beloye, Minsk Oblast,
Byelorussian SSR",Male,Balashov Higher Military Aviation School of Pilots,,,Colonel General,Russian Air Force,3,5193,,,"Soyuz 25, Soyuz 29, Soyuz T-4",,
46,Konstantin Kozeyev,1996,Retired,1967-12-01 00:00:00,"Korolyov, Russia",Male,Moscow Aviation Technology Institute,,,,,1,236,,,Soyuz TM-33,,
47,Vladimir Komarov,1961,Deceased,1927-03-16 00:00:00,"Moscow, Russia",Male,Krasnodar Higher Military Aviation School of Pilots,,,Сolonel,Russian Air Force,2,51,,,"Voskhod 1, Soyuz 1",1967-04-24 00:00:00,
48,Yelena Kondakova,1989,Retired,1957-03-30 00:00:00,"Mytishchi, Russia",Female,,,,,,1,4272,,,"Soyuz TM-20, STS-84 (Atlantis)",,
49,Dmitri Kondratyev,1997,Retired,1969-05-25 00:00:00,"Irkutsk, Russian SFSR",Male, Moscow State University for Economy/Yury A. Gagarin Air Force Academy,,,Сolonel,Russian Air Force,1,3823,2.0,10.0,Soyuz TMA-20,,
50,Oleg Kononenko,1996,Active,1964-06-21 00:00:00,"Chardzhou, Turkmen SSR",Male,N. E. Zhukovskiy Aviation Institute,,,,,3,533,3.0,18.0,"Soyuz TMA-12, Soyuz TMA-03M, Soyuz TMA-17M",,
51,Valery Korzun,1992,Retired,1953-03-05 00:00:00,"Krasny Sulin, Rostov Oblast",Male,Kachinsk higher military aviation pilot school/Gagarin Military Aviation Academy,,,Major General,Russian Air Force,2,9159,4.0,22.0,"Soyuz TM-24, STS-111 (Endeavour)",,
52,Mikhail Korniyenko,1998,Active,1960-04-05 00:00:00,"Syzran, Kuibyshev (Samara) Region, Russia",Male,Moscow Aviation Institute,,,,,2,12394,2.0,12.0,"Soyuz TMA-18, Soyuz TMA-16M",,
53,Oleg Kotov,1996,Retired,1965-10-27 00:00:00,"Simferopol, Ukrainian SSR, Soviet Union",Male,Kirov Military Medical Academy,,,Lieutenant Colonel,Russian Air Force,3,12629,6.0,37.0,"Soyuz TMA-10, Soyuz TMA-17, Soyuz TMA-10M",,
54,Sergey Krikalev,1985,Retired,1958-08-27 00:00:00,"Leningrad, Soviet Union",Male,Baltic State Technical University,,,Major,Russian Air Force,6,19281,8.0,41.0,"Soyuz TM-7, Soyuz TM-12, STS-60, STS-88 (Endeavour), Soyuz TM-31, Soyuz TMA-6",,
55,Valery Kubasov,1966,Deceased,1935-01-07 00:00:00,"Vyazniki, Ivanovo Industrial Oblast, RSFSR, USSR",Male,Moscow Aviation Institute,,,,,3,449,,,"Soyuz 6, Soyuz 19, Soyuz 36",2014-02-19 00:00:00,
56,Alexander Laveykin,1978,Retired,1951-04-21 00:00:00,"Moscow, Soviet Union",Male,Bauman Moscow State Technical University,,,,,1,4179,3.0,8.0,Soyuz TM-2,,
57,Vasily Lazarev,1964,Deceased,1928-02-23 00:00:00,"Poroshino, Altai Krai, Soviet Union",Male,Saratov Medical Institute,,,Colonel,Russian Air Force,2,2,,,"Soyuz 12, Soyuz 18a",1990-12-31 00:00:00,
58,Alexander Lazutkin,1992,Retired,1957-10-30 00:00:00,"Moscow, Russia",Male,Moscow Aviation Institute,,,Lieutenant,Russian Air Force,1,4438,,,	Soyuz TM-25,,
59,Valentin Lebedev,1965,Retired,1942-04-14 00:00:00,"Moscow, Russia",Male,Moscow Aviation Institute,,,,,2,5261,,,"Soyuz 13, Soyuz T-5",,
60,Anatoli Levchenko,1988,Deceased,1941-05-05 00:00:00,"Krasnokutsk, Ukrainian SSR, Soviet Union",Male,Chernigov High Aviation School ,,,Captain,Russian Air Force,1,192,,,Soyuz TM-4,1988-08-06 00:00:00,
61,Alexey Leonov,1960,Retired,1934-05-30 00:00:00,"Listvyanka, West Siberian Krai, Russian SFSR, Soviet Union",Male,Chuguev Military Aviation School of Pilots,,,Major General,Russian Air Force,2,168,1.0,0.5,"Voskhod 2, Soyuz 19",,
62,Yury Lonchakov,1997,Retired,1965-03-04 00:00:00,"Balqash, Kazakh SSR",Male,Orenburg Air Force Pilot School/Zhukovski Air Force Academy,,,Colonel,Russian Air Force,3,4818,2.0,10.0,"STS-100, Soyuz TMA-1/TM-34, Soyuz TMA-13 (Expedition 18)",,
63,Vladimir Lyakhov,1985,Retired,1941-07-20 00:00:00,"Antratsyt, Luhansk Oblast, Ukrainian SSR, USSR",Male,The Air Force Academy named after Yu. A. Gagarin,,,Lieutenant General,Russian Air Force,3,8000,,,"Soyuz 32, Soyuz T-9, Soyuz TM-6",,
64,Oleg Makarov,1966,Deceased,1933-01-06 00:00:00,"Udomlya, Russia",Male,Bauman Moscow Higher Technical School ,,,,,4,497,,,"Soyuz 12, Soyuz 18a, Soyuz 27, Soyuz T-3",2003-05-28 00:00:00,
65,Yury Malenchenko,1987,Retired,1961-12-22 00:00:00,"Svitlovodsk, Ukraine",Male,Kharkov Higher Military Aviation School of Pilots named. S.I. Gritsevets,,,Colonel,Russian Air Force,6,19857,6.0,35.0,"Soyuz TM-19, STS-106 (Atlantis), Soyuz TMA-2, Soyuz TMA-11, Soyuz TMA-05M, Soyuz TMA-19M",,
66,Yury Malyshev,1967,Retired,1941-08-27 00:00:00,"Nikolayevsk, Volgograd Oblast, USSR",Male,Kharkov Higher Military Aviation School of Pilots ,,,Colonel,Russian Air Force,2,288,,,"Soyuz T-2, Soyuz T-11",1999-11-08 00:00:00,
67,Gennady Manakov,1985,Retired,1950-06-01 00:00:00,"Yefimovka, Russia",Male,Kuibyshev Aviation Institute,,,Colonel,Russian Air Force,2,7437,,,"Soyuz TM-10, Soyuz TM-16",,
68,Musa Manarov,1978,Retired,1951-03-22 00:00:00,"Baku, Azerbaijan SSR",Male,Moscow Aviation Institute,,,Colonel,Russian Air Force,2,12984,,,"Soyuz TM-4, Soyuz TM-11",,
69,Alexander Misurkin,2006,Active,1977-09-23 00:00:00,"Yershichi, Smolensk Oblast, Russia",Male,Armavir Military Aviation Institute,,,Major,Russian Air Force,2,3984,3.0,20.0,"Soyuz TMA-08M, Soyuz MS-06",,
70,Boris Morukov,1989,Deceased,1950-10-01 00:00:00,"Moscow, Russia",Male,Sechenov University ,,,,,1,283,,,STS-106 (Atlantis),2015-01-01 00:00:00,
71,Talgat Musabayev,1990,Retired,1951-01-07 00:00:00,"Kargaly, Kazakhstan ",Male,Engineering Institute of Civil Aviation in Riga,,,Major General,Russian Air Force,3,8194,7.0,41.0,"Soyuz TM-19, Soyuz TM-27, Soyuz TM-32",,
72,Andriyan Nikolayev,1960,Deceased,1929-09-05 00:00:00,"Shorshely, Russian SFSR, Soviet Union",Male,Chernigov High Aviation School ,,,Major General,Russian Air Force,2,519,,,"Vostok 3, Soyuz 9",2004-07-03 00:00:00,
73,Oleg Novitskiy,2006,Active,1971-10-12 00:00:00,"Cherven, Minsk Voblast, Belarus",Male,Kachinskoye Military Pilot School named after A. Myasnikov/ Yury Gagarin Air Force Academy,,,Lieutenant Colonel,Russian Air Force,2,8170,,,"Soyuz TMA-06M, Soyuz MS-03",,
74,Aleksey Ovchinin,2006,Active,1971-09-28 00:00:00,"Rybinsk, Yaroslavl Oblast, Russian SFSR",Male,Yeysk Military Aviation College,,,Lieutenant Colonel,Russian Air Force,1,4131,,,	Soyuz TMA-20M,,
75,Yury Onufriyenko,1989,Retired,1961-02-06 00:00:00,"Ryasne, Ukraine, Soviet Union",Male,Yeysk Military Aviation College/ Moscow State University,,,Colonel,Russian Air Force,2,9351,8.0,43.0,"Soyuz TM-23, STS-108 (Endeavour)",,
76,Gennady Padalka,1989,Retired,1958-06-21 00:00:00,"Krasnodar, Russia",Male,Yeysk Military Aviation College,,,Colonel,Russian Air Force,5,21083,10.0,39.0,"Soyuz TM-28, Soyuz TMA-4, Soyuz TMA-14, Soyuz TMA-04M, Soyuz TMA-16M",,
77,Victor Patsayev,1968,Deceased,1933-06-19 00:00:00,"Aktyubinsk, Kazakh SSR, Soviet Union",Male,Penza Industrial Institute,,,,,1,570,,,Soyuz 11,1971-06-30 00:00:00,Soyuz 11
78,Alexander Poleshchuk,1989,Retired,1953-10-30 00:00:00,"Cheremkhovo, Russia",Male,Moscow Aviation Institute,,,Captain,Russian Air Force,1,4297,2.0,10.0,Soyuz TM-16,,
79,Valery Polyakov,1972,Retired,1942-04-27 00:00:00,"Tula, Tula Oblast, Russia",Male,Sechenov University,,,Lieutenant Colonel,Russian Air Force,2,16288,,,"Soyuz TM-6,Soyuz TM-18",,
80,Leonid Popov,1970,Retired,1945-08-31 00:00:00,"Oleksandriia, Ukraine",Male,Chernigov High Aviation School ,,,Major General,Russian Air Force,3,4815,,,"Soyuz 35, Soyuz 40, Soyuz T-7",,
81,Pavel Popovich,1960,Retired,1930-10-05 00:00:00,"Uzyn, Ukraine)",Male,Air Force Engineering Academy named after Zhukovsky,,,Major General,Russian Air Force,2,448,,,"Vostok 4, Soyuz 14",2009-09-29 00:00:00,
82,Sergey Revin,1996,Retired,1966-12-12 00:00:00,"Moscow, Russia",Male,Moscow Institute of Electronic Technology,,,Lieutenant Colonel,Russian Air Force,1,3000,,,Soyuz TMA-04M,,
83,Valery Rozhdestvensky,1965,Deceased,1939-02-13 00:00:00,"St.Petersburg, Russia",Male,Higher Military Engineering School ,,,,,1,48,,,Soyuz 23,2011-08-31 00:00:00,
84,Roman Romanenko,1997,Retired,1971-08-09 00:00:00,"Shchyolkovo, Russia",Male,Chernigov High Air Force School,,,Major,Russian Air Force,2,8003,1.0,7.0,"Soyuz TMA-15, Soyuz TMA-07M",,
85,Yury Romanenko,1970,Retired,1944-08-01 00:00:00,"Orenburg, Russia",Male,Chernigov High Air Force School,,,Colonel,Russian Air Force,3,10338,4.0,10.0,"Soyuz 26, Soyuz 38, Soyuz TM-2",,
86,Nikolay Rukavishnikov,1967,Deceased,1932-09-18 00:00:00,"Tomsk, Russia",Male,Moscow Engineering and Physics Institute,,,,,3,237,,,"Soyuz 10, Soyuz 16, Soyuz 33",2002-10-19 00:00:00,
87,Sergey Ryzhikov,2006,Retired,1974-08-19 00:00:00,"Bugulma, Tatarstan",Male,Orenburg Higher Military Aviation Red Banner School of Pilots named after I.S. Polbina,,,Lieutenant Colonel,Russian Air Force,1,173,,,Soyuz MS-02,,
88,Valery Ryumin,1973,Retired,1939-08-16 00:00:00,"Komsomolsk-on-Amur, Russia",Male, Moscow Forestry Engineering Institute,,,Lieutenant Colonel,Russian Air Force,4,9292,1.0,1.0,"Soyuz 25, Soyuz 32, Soyuz 35, STS-91 (Discovery)",,
89,Sergey Ryazansky,2003,Active,1974-11-13 00:00:00,"Moscow, Russia",Male, Moscow State University ,,,,,2,7318,4.0,28.0,"Soyuz TMA-10M, Soyuz MS-05",,
90,Victor Savinykh,1978,Retired,1940-03-07 00:00:00,"Berezkiny, Kirov Oblast, Russia",Male,"Moscow Institute of Engineers in Geodesy, Aerophotography and Cartography",,,,,3,6066,,,"Soyuz T-4, Soyuz T-13, Soyuz TM-5",,
91,Svetlana Savitskaya,1980,Retired,1948-08-08 00:00:00,"Moscow, Russia",Female,Moscow Aviation Institute,,,,,2,473,1.0,4.0,"Soyuz T-7, Soyuz T-12",,
92,Alexander Samokutyayev,2003,Retired,1970-03-13 00:00:00,"Penza, Russia",Male,Penza politechnical institute/Chernigov High Air Force School,,,Colonel,Russian Air Force,2,7955,2.0,10.0,"Soyuz TMA-21, Soyuz TMA-14M",,
93,Gennady Sarafanov,1965,Deceased,1942-01-01 00:00:00,"Sinenkie, Saratov Oblast, Russia",Male, Soviet Air Force academy,,,Colonel,Russian Air Force,1,48,,,Soyuz 15,2005-09-29 00:00:00,
94,Vitaly Sevastyanov,1968,Deceased,1935-07-08 00:00:00,"Krasnouralsk,Russia",Male,Moscow Aviation Institute ,,,Colonel,Russian Air Force,2,1936,,,"Soyuz 9, Soyuz 18",2010-04-05 00:00:00,
95,Alexander Serebrov,1978,Deceased,1944-02-15 00:00:00,"Moscow, Russia",Male,Moscow Institute of Physics and Technology,,,,,4,8951,10.0,32.0,"Soyuz T-7, Soyuz T-8, Soyuz TM-8, Soyuz TM-17",2013-11-12 00:00:00,
96,Yelena Serova,2006,Active,1976-04-22 00:00:00,"Vozdvizhenka, Primorsky Krai, Russia",Female, Moscow Aviation Institute,,,,,1,4008,,,Soyuz TMA-14M,,
97,"Alexander Skvortsov, Mikhail Korniyenko, Tracy E. Caldwell Dyson",1997,Active,1966-05-06 00:00:00,"Schelkovo, Moscow Oblast, Russia",Male,Stavropol Air Force Pilot and Navigator School,,,Colonel,Russian Air Force,2,8286,2.0,13.0,"Soyuz TMA-18, Soyuz TMA-12M",,
98,Oleg Skripochka,1997,Active,1969-12-24 00:00:00,"Nevinnomyssk, Stavropol Krai, Russia",Male,Bauman Moscow State Technical University ,,,,,2,7956,3.0,17.0,"Soyuz TMA-01M, Soyuz TMA-20M",,
99,Anatoly Solovyev,1976,Retired,1948-01-16 00:00:00,"Riga, Latvia",Male,Chernigov High Air Force School,,,Colonel,Russian Air Force,5,15624,16.0,82.0,"Soyuz TM-5, Soyuz TM-9, Soyuz TM-15, STS-71 (Atlantis), Soyuz TM-26",,
100,Vladimir Solovyov,1978,Retired,1946-11-11 00:00:00,"Moscow, Russia",Male,Bauman Moscow State Technical University ,,,,,2,8687,8.0,31.0,"Soyuz T-10, Soyuz T-15",,
101,Gennady Strekalov,1973,Deceased,1940-10-26 00:00:00,"Mytishchi, Russia",Male,Bauman Moscow State Technical University ,,,,,5,6454,3.0,13.0,"Soyuz T-3, Soyuz T-8, Soyuz T-10-1, Soyuz T-11, Soyuz TM-10, Soyuz TM-21",2004-12-25 00:00:00,
102,Maksim Surayev,1997,Retired,1972-05-24 00:00:00,"Chelyabinsk, Russia",Male,Kacha Air Force Pilot School/Russian Academy of Civil Service,,,Colonel,Russian Air Force,2,8028,2.0,9.0,"Soyuz TMA-16, Soyuz TMA-13M",,
103,Evgeny Tarelkin,2003,Retired,1974-12-29 00:00:00,"Chita Oblast, Russia",Male,Yeysk Air Force School/Gagarin Air Force Academy ,,,Capitan,Russian Air Force,1,3448,,,Soyuz TMA-06M,,
104,Valentina Tereshkova,1962,Retired,1937-03-06 00:00:00,"Bolshoye Maslennikovo, Yaroslavl Oblast, Russia",Female,Yaroslavl technical college of light industry,,,Major General,Russian Air Force,1,72,,,Vostok 6,,
105,Gherman Titov,1960,Deceased,1935-09-11 00:00:00,"Verkhneye Zhilino, West Siberian Krai, Russia",Male,Stalingrad Military Aviation School,,,General Colonel,Russian Air Force,1,25,,,Vostok 2,2000-09-20 00:00:00,
106,Vladimir Titov,1976,Retired,1947-01-01 00:00:00,"Sretensk, Chita Oblast, Russia",Male,Gagarin Air Force Academy,,,Colonel,Russian Air Force,4,9072,4.0,19.0,"Soyuz T-8, Soyuz T-10-1, Soyuz TM-4, STS-86 (Atlantis)",,
107,Valery Tokarev,1989,Retired,1952-10-29 00:00:00,"Kapustin Yar, Astrakhan Oblast, Russia",Male, Stavropol Higher Military Aviation School for Pilots and Navigators,,,Colonel,Russian Air Force,2,4791,2.0,11.0,"STS-96 (Discovery), Soyuz TMA-7",,
108,Sergey Treshchov,1992,Retired,1958-08-18 00:00:00,"Krasnuy Kustar, Lipetsk Oblast, Russia",Male,Moscow Power Institute ,,,,,1,4438,1.0,5.0,STS-111 (Endeavour),,
109,Mikhail TYuryn,1994,Retired,1960-03-02 00:00:00,"Kolomna, Russia",Male,Moscow Aviation Institute ,,,,,3,12771,4.0,17.0,"STS-105 (Discovery), Soyuz TMA-9 , Soyuz TMA-11M",,
110,Yury Usachyev,1989,Retired,1957-10-09 00:00:00,"Donetsk, Rostov Oblast, Russia",Male,Moscow Aviation Institute ,,,Lieutenant,Russian Air Force,4,13270,7.0,29.0,"Soyuz TM-18, Soyuz TM-23, STS-101 (Atlantis), STS-102 (Discovery)",,
111,Konstantin Feoktistov,1964,Deceased,1926-02-07 00:00:00,"Voronezh, Russia",Male,Bauman Moscow State Technical University ,,,,,1,24,,,Voskhod 1,2009-11-21 00:00:00,
112,Anatoly Filipchenko,1963,Retired,1928-02-26 00:00:00,"Davydovka, Russia",Male,Chuguev Military Aviation School of Pilots,,,Major General,Russian Air Force,2,261,,,Soyuz 7 Soyuz 16,,
113,Yevgeny Khrunov,1960,Deceased,1933-09-10 00:00:00,"Tula, Russia",Male,Serov Higher Air Force School,,,Colonel,Russian Air Force,1,48,,,Soyuz 5,2000-05-20 00:00:00,
114,Vasily Tsiblyev,1987,Retired,1954-02-20 00:00:00,"Orekhovka, Crimea, Ukraine",Male,Kharkov Higher Military Aviation School of Pilots ,,,Lieutenant General,Russian Air Force,2,9160,,,"Soyuz TM-17, Soyuz TM-25",,
115,Yury Shargin,1996,Retired,1960-03-20 00:00:00,"Engels, Russia",Male,Military Engineering Academy for Aeronautics and Astronautics,,,Lieutenant Colonel,Russian Air Force,1,237,,,Soyuz TMA-5,,
116,Salizhan Sharipov,1990,Retired,1964-08-24 00:00:00,"Uzgen, Osh oblast, Kyrgyztan",Male,Moscow State University ,,,Colonel,Russian Air Force,2,4839,2.0,11.0,"STS-89 (Endeavour), Soyuz TMA-5",,
117,Vladimir Shatalov,1963,Retired,1927-12-08 00:00:00,"Petropavlovsk, Kazakhstan",Male,Kacha Air Force Pilot School,,,Lieutenant General,Russian Air Force,3,238,,,"Soyuz 4, Soyuz 8, Soyuz 10",,
118,Anton Shkaplerov,2003,Active,1972-02-20 00:00:00,"Sevastopol, Ukraine",Male,N. E. Zhukovskiy Aviation Institute,,,Colonel,Russian Air Force,3,8760,1.0,6.0,"Soyuz TMA-22, Soyuz TMA-15M, Soyuz MS-07",,
119,Georgy Shonin,1960,Deceased,1935-08-03 00:00:00,"Rovenky, Ukraine",,N. E. Zhukovskiy Aviation Institute,,,Lieutenant General,Russian Air Force,1,119,,,Soyuz 6,1997-04-07 00:00:00,
120,Fyodor Yurchikhin,1997,Active,1959-01-03 00:00:00,"Batumi, Adjar ASSR, Georgia",,Moscow Aviation Institute ,,,,,5,16149,9.0,59.0,"STS-112 (Atlantis), Soyuz TMA-10, Soyuz TMA-19, Soyuz TMA-09M, Soyuz MS-04",,
